<?xml version="1.0" standalone="no"?>
<!DOCTYPE entity PUBLIC "-//UC Berkeley//DTD MoML 1//EN"
    "http://ptolemy.eecs.berkeley.edu/xml/dtd/MoML_1.dtd">
<entity name="" class="ptolemy.actor.TypedCompositeActor">
    <property name="_vergilSize" class="ptolemy.actor.gui.SizeAttribute" value="[600, 450]">
    </property>
    <property name="_vergilLocation" class="ptolemy.actor.gui.LocationAttribute" value="[104, 102]">
    </property>
    <property name="DE" class="ptolemy.domains.de.kernel.DEDirector">
        <property name="stopTime" class="ptolemy.data.expr.Parameter" value="10.0">
        </property>
        <property name="_location" class="ptolemy.moml.Location" value="95.0, 75.0">
        </property>
    </property>
    <entity name="Inhibit" class="ptolemy.domains.de.lib.Inhibit">
        <property name="_location" class="ptolemy.moml.Location" value="290.0, 204.5">
        </property>
    </entity>
    <entity name="Clock" class="ptolemy.actor.lib.Clock">
        <property name="period" class="ptolemy.data.expr.Parameter" value="4.0">
        </property>
        <doc>Create a generalized square wave</doc>
        <property name="_location" class="ptolemy.moml.Location" value="130.0, 174.5">
        </property>
    </entity>
    <entity name="Clock2" class="ptolemy.actor.lib.Clock">
        <property name="period" class="ptolemy.data.expr.Parameter" value="4.0">
        </property>
        <property name="offsets" class="ptolemy.data.expr.Parameter" value="{0.0, 2.0}">
        </property>
        <doc>Create a generalized square wave</doc>
        <property name="_location" class="ptolemy.moml.Location" value="130.0, 240.0">
        </property>
    </entity>
    <entity name="Test" class="ptolemy.actor.lib.Test">
        <property name="correctValues" class="ptolemy.data.expr.Parameter" value="{1.0,5.0,9.0}">
        </property>
        <property name="_location" class="ptolemy.moml.Location" value="501.5, 204.5">
        </property>
    </entity>
    <entity name="CurrentTime" class="ptolemy.actor.lib.CurrentTime">
        <property name="_location" class="ptolemy.moml.Location" value="391.5, 204.5">
        </property>
    </entity>
    <relation name="relation" class="ptolemy.actor.TypedIORelation">
    </relation>
    <relation name="relation4" class="ptolemy.actor.TypedIORelation">
    </relation>
    <relation name="relation5" class="ptolemy.actor.TypedIORelation">
    </relation>
    <relation name="relation6" class="ptolemy.actor.TypedIORelation">
    </relation>
    <link port="Inhibit.input" relation="relation"/>
    <link port="Inhibit.output" relation="relation5"/>
    <link port="Inhibit.inhibit" relation="relation4"/>
    <link port="Clock.output" relation="relation"/>
    <link port="Clock2.output" relation="relation4"/>
    <link port="Test.input" relation="relation6"/>
    <link port="CurrentTime.output" relation="relation6"/>
    <link port="CurrentTime.trigger" relation="relation5"/>
</entity>
