<?xml version="1.0" standalone="no"?>
<!DOCTYPE plot PUBLIC "-//UC Berkeley//DTD MoML 1//EN"
    "http://ptolemy.eecs.berkeley.edu/xml/dtd/MoML_1.dtd">
<entity name="signal processing" class="ptolemy.moml.EntityLibrary">
  <configure>
    <?moml
      <group>
  <doc>Signal processing actors</doc>

  <entity name="DB" class="ptolemy.actor.lib.DB">
  </entity>

<entity name="FIR" class="ptolemy.domains.sdf.lib.FIR">
<doc>FIR filter</doc>
</entity>

<entity name="IIR" class="ptolemy.actor.lib.IIR">
<doc>IIR filter</doc>
</entity>

<entity name="LineCoder" class="ptolemy.domains.sdf.lib.LineCoder">
</entity>

<entity name="RaisedCosine" class="ptolemy.domains.sdf.lib.RaisedCosine">
</entity>

<!-- NOTE: Collect everything that is imported into this one file,
     because when any imported object is dropped into a model, all
     files imported by this library will be imported by the model.
     May as well keep it to one file. -->
<import source="ptolemy/actor/lib/SignalProcessingActors.xml"/>
<entity name="Sinewave" class=".SignalProcessingActors.Sinewave"/>

        <!-- NOTE: javasound actors only work under jdk1.3. -->
        <input source="javasound/index.xml"/>
	<!-- NOTE: This next one is labeled as image processing."-->
        <input source="../../domains/sdf/lib/vq/sdfvqentities.xml"/>

      </group>
    ?>
  </configure>
</entity>


