<?xml version="1.0" standalone="no"?>
<!DOCTYPE entity PUBLIC "-//UC Berkeley//DTD MoML 1//EN"
    "http://ptolemy.eecs.berkeley.edu/xml/dtd/MoML_1.dtd">
<entity name="DerivedAgain" class="ptolemy.actor.TypedCompositeActor">
    <property name="_createdBy" class="ptolemy.kernel.attributes.VersionAttribute" value="11.0.devel">
    </property>
    <property name="_windowProperties" class="ptolemy.actor.gui.WindowPropertiesAttribute" value="{bounds={9, 26, 934, 636}, maximized=false}">
    </property>
    <property name="_vergilSize" class="ptolemy.actor.gui.SizeAttribute" value="[700, 526]">
    </property>
    <property name="_vergilZoomFactor" class="ptolemy.data.expr.ExpertParameter" value="1.0000000000000002">
    </property>
    <property name="_vergilCenter" class="ptolemy.data.expr.ExpertParameter" value="{339.99999999999983, 252.99999999999963}">
    </property>
    <property name="DE Director" class="ptolemy.domains.de.kernel.DEDirector">
        <property name="stopWhenQueueIsEmpty" class="ptolemy.data.expr.Parameter" value="true">
        </property>
        <property name="synchronizeToRealTime" class="ptolemy.data.expr.Parameter" value="false">
        </property>
        <property name="_location" class="ptolemy.kernel.util.Location" value="{120, 35}">
        </property>
    </property>
    <property name="Annotation" class="ptolemy.vergil.kernel.attributes.TextAttribute">
        <property name="text" class="ptolemy.kernel.util.StringAttribute" value="Test that a derived accessor can see 2 inheritance levels above it.&#10;&#10;Base3:&#10;exports.baseField = 1;&#10;&#10;Derived3 extends Base3&#10;exports.derivedField = 2;&#10;&#10;DerivedAgain extends Derived3.&#10;&#10;ensure DerivedAgain can access baseField and derivedField">
        </property>
        <property name="_location" class="ptolemy.kernel.util.Location" value="[5.0, 315.0]">
        </property>
    </property>
    <entity name="SingleEvent" class="ptolemy.actor.lib.SingleEvent">
        <property name="time" class="ptolemy.data.expr.Parameter" value="1.0">
        </property>
        <property name="_location" class="ptolemy.kernel.util.Location" value="[190.0, 210.0]">
        </property>
    </entity>
    <entity name="Test" class="ptolemy.actor.lib.Test">
        <property name="correctValues" class="ptolemy.data.expr.Parameter" value="{1}">
        </property>
        <property name="requireAllCorrectValues" class="ptolemy.actor.parameters.SharedParameter" value="true">
        </property>
        <property name="trainingMode" class="ptolemy.actor.parameters.SharedParameter" value="false">
        </property>
        <property name="_location" class="ptolemy.kernel.util.Location" value="[555.0, 150.0]">
        </property>
    </entity>
    <entity name="Test2" class="ptolemy.actor.lib.Test">
        <property name="correctValues" class="ptolemy.data.expr.Parameter" value="{2}">
        </property>
        <property name="requireAllCorrectValues" class="ptolemy.actor.parameters.SharedParameter" value="true">
        </property>
        <property name="trainingMode" class="ptolemy.actor.parameters.SharedParameter" value="false">
        </property>
        <property name="_location" class="ptolemy.kernel.util.Location" value="[550.0, 225.0]">
        </property>
    </entity>
    <entity name="DerivedAgain" class="org.terraswarm.accessor.JSAccessor">
        <property name="script" class="ptolemy.actor.parameters.PortParameter" value="exports.setup = function() {&#10;   extend('Derived3');&#10;   output('out2');&#10;}&#10;&#10;//Override input Handler of base. try to access fields defined in&#10;//base and derived&#10;exports.inputHandler = function() {&#10;   send('out1', this.baseField);&#10;   send('out2', this.derivedField);&#10;}&#10;&#10;exports.initialize = function() {&#10;   Object.getPrototypeOf(exports).initialize.apply(this);&#10;}&#10;&#10;&#10;&#10;">
        </property>
        <property name="accessorSource" class="org.terraswarm.accessor.JSAccessor$ActionableAttribute" value="$CLASSPATH/org/terraswarm/accessor/test/auto/accessors/DerivedAgain.js">
        </property>
        <property name="_location" class="ptolemy.kernel.util.Location" value="[315.0, 210.0]">
        </property>
        <property name="_expertMode" class="ptolemy.kernel.util.SingletonAttribute">
        </property>
        <port name="in1" class="ptolemy.actor.TypedIOPort">
            <property name="input"/>
            <property name="_showName" class="ptolemy.data.expr.SingletonParameter" value="true">
            </property>
        </port>
        <port name="out1" class="ptolemy.actor.TypedIOPort">
            <property name="output"/>
            <property name="_showName" class="ptolemy.data.expr.SingletonParameter" value="true">
            </property>
        </port>
        <port name="out2" class="ptolemy.actor.TypedIOPort">
            <property name="output"/>
            <property name="_showName" class="ptolemy.data.expr.SingletonParameter" value="true">
            </property>
        </port>
    </entity>
    <entity name="Display" class="ptolemy.actor.lib.gui.Display">
        <property name="_windowProperties" class="ptolemy.actor.gui.WindowPropertiesAttribute" value="{bounds={879, 57, 535, 216}, maximized=false}">
        </property>
        <property name="_paneSize" class="ptolemy.actor.gui.SizeAttribute" value="[535, 172]">
        </property>
        <property name="_location" class="ptolemy.kernel.util.Location" value="[455.0, 95.0]">
        </property>
    </entity>
    <entity name="Display2" class="ptolemy.actor.lib.gui.Display">
        <property name="_windowProperties" class="ptolemy.actor.gui.WindowPropertiesAttribute" value="{bounds={881, 303, 535, 216}, maximized=false}">
        </property>
        <property name="_paneSize" class="ptolemy.actor.gui.SizeAttribute" value="[535, 172]">
        </property>
        <property name="_location" class="ptolemy.kernel.util.Location" value="[495.0, 310.0]">
        </property>
    </entity>
    <relation name="relation3" class="ptolemy.actor.TypedIORelation">
        <property name="width" class="ptolemy.data.expr.Parameter" value="-1">
        </property>
        <vertex name="vertex1" value="{420.0, 155.0}">
        </vertex>
    </relation>
    <relation name="relation4" class="ptolemy.actor.TypedIORelation">
        <property name="width" class="ptolemy.data.expr.Parameter" value="-1">
        </property>
        <vertex name="vertex1" value="[420.0, 220.0]">
        </vertex>
    </relation>
    <relation name="relation" class="ptolemy.actor.TypedIORelation">
    </relation>
    <link port="SingleEvent.output" relation="relation"/>
    <link port="Test.input" relation="relation3"/>
    <link port="Test2.input" relation="relation4"/>
    <link port="DerivedAgain.in1" relation="relation"/>
    <link port="DerivedAgain.out1" relation="relation3"/>
    <link port="DerivedAgain.out2" relation="relation4"/>
    <link port="Display.input" relation="relation3"/>
    <link port="Display2.input" relation="relation4"/>
</entity>
