<?xml version="1.0" standalone="no"?>
<!DOCTYPE class PUBLIC "-//UC Berkeley//DTD MoML 1//EN"
    "http://ptolemy.eecs.berkeley.edu/xml/dtd/MoML_1.dtd">
<class name="ModelUpdater" extends="ptolemy.domains.erg.kernel.ERGModalModel">
    <property name="_createdBy" class="ptolemy.kernel.attributes.VersionAttribute" value="7.1.devel">
    </property>
    <property name="_location" class="ptolemy.kernel.util.Location" value="{235, 135}">
    </property>
    <property name="_ignore" class="ptolemy.actor.gt.IgnoringAttribute">
    </property>
    <property name="FileUpdater" class="ptolemy.actor.gt.controller.FileUpdater">
    </property>
    <entity name="_Controller" class="ptolemy.domains.erg.kernel.ERGController">
        <property name="_Director" class="ptolemy.domains.erg.kernel.ERGDirector">
            <property name="_location" class="ptolemy.kernel.util.Location" value="{0.0, 0.0}">
            </property>
        </property>
        <property name="_library" class="ptolemy.moml.LibraryAttribute">
            <configure>
        <entity name="EventLibrary" class="ptolemy.kernel.CompositeEntity"><input source="ptolemy/configs/basicUtilities.xml"></input><entity name="Event" class="ptolemy.domains.erg.kernel.Event"><property name="_controllerFactory" class="ptolemy.vergil.fsm.modal.HierarchicalStateControllerFactory"></property></entity><entity name="Match" class="ptolemy.actor.gt.controller.Match"></entity><entity name="Test" class="ptolemy.actor.gt.controller.Test"></entity><entity name="Transform" class="ptolemy.actor.gt.controller.Transform"></entity><property name="SynchronizeToRealtime" class="ptolemy.domains.erg.lib.SynchronizeToRealtime"><property name="_icon" class="ptolemy.vergil.icon.ValueIcon"><property name="_color" class="ptolemy.actor.gui.ColorAttribute" value="{0.0, 0.0, 1.0, 1.0}"></property></property><property name="_smallIconDescription" class="ptolemy.kernel.util.SingletonConfigurableAttribute"><configure>
                  <svg>
                    <circle cx="3" cy="3" r="2" style="fill:#0000FF"></circle>
                  </svg>
                </configure></property><property name="_editorFactory" class="ptolemy.vergil.toolbox.VisibleParameterEditorFactory"></property></property></entity>
          </configure>
        </property>
        <property name="_windowProperties" class="ptolemy.actor.gui.WindowPropertiesAttribute" value="{bounds={288, 268, 823, 514}, maximized=false}">
        </property>
        <property name="_vergilSize" class="ptolemy.actor.gui.SizeAttribute" value="[600, 400]">
        </property>
        <property name="_vergilZoomFactor" class="ptolemy.data.expr.ExpertParameter" value="1.0">
        </property>
        <property name="_vergilCenter" class="ptolemy.data.expr.ExpertParameter" value="{300.0, 200.0}">
        </property>
        <property name="HostModel" class="ptolemy.actor.gt.controller.ModelAttribute">
            <property name="_icon" class="ptolemy.vergil.icon.EditorIcon">
                <property name="line" class="ptolemy.vergil.kernel.attributes.LineAttribute">
                    <property name="_location" class="ptolemy.kernel.util.Location" value="[1.0, -5.0]">
                    </property>
                    <property name="lineWidth" class="ptolemy.data.expr.Parameter" value="2.0">
                    </property>
                    <property name="x" class="ptolemy.data.expr.Parameter" value="0.0">
                    </property>
                    <property name="y" class="ptolemy.data.expr.Parameter" value="15.0">
                    </property>
                </property>
                <property name="line2" class="ptolemy.vergil.kernel.attributes.LineAttribute">
                    <property name="_location" class="ptolemy.kernel.util.Location" value="[-12.0, 1.0]">
                    </property>
                    <property name="lineWidth" class="ptolemy.data.expr.Parameter" value="2.0">
                    </property>
                    <property name="x" class="ptolemy.data.expr.Parameter" value="12.0">
                    </property>
                    <property name="y" class="ptolemy.data.expr.Parameter" value="-5.0">
                    </property>
                </property>
                <property name="line3" class="ptolemy.vergil.kernel.attributes.LineAttribute">
                    <property name="_location" class="ptolemy.kernel.util.Location" value="[2.0, -4.0]">
                    </property>
                    <property name="lineWidth" class="ptolemy.data.expr.Parameter" value="2.0">
                    </property>
                    <property name="x" class="ptolemy.data.expr.Parameter" value="12.0">
                    </property>
                    <property name="y" class="ptolemy.data.expr.Parameter" value="5.0">
                    </property>
                </property>
                <property name="line4" class="ptolemy.vergil.kernel.attributes.LineAttribute">
                    <property name="_location" class="ptolemy.kernel.util.Location" value="[-11.0, 18.0]">
                    </property>
                    <property name="lineWidth" class="ptolemy.data.expr.Parameter" value="2.0">
                    </property>
                    <property name="x" class="ptolemy.data.expr.Parameter" value="12.0">
                    </property>
                    <property name="y" class="ptolemy.data.expr.Parameter" value="-8.0">
                    </property>
                </property>
                <property name="line5" class="ptolemy.vergil.kernel.attributes.LineAttribute">
                    <property name="_location" class="ptolemy.kernel.util.Location" value="[1.0, 10.0]">
                    </property>
                    <property name="lineWidth" class="ptolemy.data.expr.Parameter" value="2.0">
                    </property>
                    <property name="x" class="ptolemy.data.expr.Parameter" value="12.0">
                    </property>
                    <property name="y" class="ptolemy.data.expr.Parameter" value="8.0">
                    </property>
                </property>
                <property name="ellipse" class="ptolemy.vergil.kernel.attributes.EllipseAttribute">
                    <property name="_location" class="ptolemy.kernel.util.Location" value="1.0, -12.0">
                    </property>
                    <property name="width" class="ptolemy.data.expr.Parameter" value="16.0">
                    </property>
                    <property name="height" class="ptolemy.data.expr.Parameter" value="16.0">
                    </property>
                    <property name="centered" class="ptolemy.data.expr.Parameter" value="true">
                    </property>
                    <property name="fillColor" class="ptolemy.actor.gui.ColorAttribute" value="{1.0, 1.0, 1.0, 1.0}">
                    </property>
                    <property name="_renderLast" class="ptolemy.kernel.util.SingletonAttribute">
                    </property>
                </property>
            </property>
            <property name="_location" class="ptolemy.kernel.util.Location" value="[515.0, 45.0]">
            </property>
        </property>
        <property name="Matched" class="ptolemy.data.expr.Parameter" value="false">
            <property name="_hideName" class="ptolemy.kernel.util.SingletonAttribute">
            </property>
            <property name="_icon" class="ptolemy.vergil.icon.ValueIcon">
                <property name="_color" class="ptolemy.actor.gui.ColorAttribute" value="{0.0, 0.0, 1.0, 1.0}">
                </property>
            </property>
            <property name="_smallIconDescription" class="ptolemy.kernel.util.SingletonConfigurableAttribute">
                <configure>
      <svg>
        <text x="20" style="font-size:14; font-family:SansSerif; fill:blue" y="20">-P-</text>
      </svg>
    </configure>
            </property>
            <property name="_editorFactory" class="ptolemy.vergil.toolbox.VisibleParameterEditorFactory">
            </property>
            <property name="_location" class="ptolemy.kernel.util.Location" value="[500.0, 80.0]">
            </property>
        </property>
        <entity name="init" class="ptolemy.actor.gt.controller.InitContainingModelEvent">
            <property name="isInitialState" class="ptolemy.data.expr.Parameter" value="true">
            </property>
            <property name="isInitialEvent" class="ptolemy.data.expr.Parameter" value="true">
            </property>
            <property name="InitEventIcon" class="ptolemy.vergil.erg.EventIcon">
                <property name="_fill" class="ptolemy.data.expr.Parameter" value="{1.0, 0.8, 0.8, 0.8}">
                </property>
            </property>
            <property name="_hideName" class="ptolemy.data.expr.SingletonParameter" value="true">
            </property>
            <property name="_location" class="ptolemy.kernel.util.Location" value="[65.0, 40.0]">
            </property>
        </entity>
    </entity>
</class>
