<?xml version="1.0" standalone="no"?>
<!DOCTYPE plot PUBLIC "-//UC Berkeley//DTD MoML 1//EN"
"http://ptolemy.eecs.berkeley.edu/xml/dtd/MoML_1.dtd">
<!-- Do not Edit - Automatically generated by make -->
<entity name="ptolemy/apps/hsif/lib" class="ptolemy.moml.EntityLibrary">
<doc>HSIF library</doc>
  <configure>
    <?moml
      <group>

<entity name="Action" class="ptolemy.apps.hsif.lib.Action">
<doc></doc>
</entity>

<entity name="AlgEquation" class="ptolemy.apps.hsif.lib.AlgEquation">
<doc></doc>
</entity>

<entity name="BooleanParameter" class="ptolemy.apps.hsif.lib.BooleanParameter">
<doc></doc>
</entity>

<entity name="BooleanVariable" class="ptolemy.apps.hsif.lib.BooleanVariable">
<doc></doc>
</entity>

<entity name="Channel" class="ptolemy.apps.hsif.lib.Channel">
<doc></doc>
</entity>

<entity name="Constraint" class="ptolemy.apps.hsif.lib.Constraint">
<doc></doc>
</entity>

<entity name="DNHA" class="ptolemy.apps.hsif.lib.DNHA">
<doc></doc>
</entity>

<entity name="DiscreteState" class="ptolemy.apps.hsif.lib.DiscreteState">
<doc></doc>
</entity>

<entity name="FlowEquation" class="ptolemy.apps.hsif.lib.FlowEquation">
<doc></doc>
</entity>

<entity name="Guard" class="ptolemy.apps.hsif.lib.Guard">
<doc></doc>
</entity>

<entity name="HybridAutomaton" class="ptolemy.apps.hsif.lib.HybridAutomaton">
<doc></doc>
</entity>

<entity name="IntegerParameter" class="ptolemy.apps.hsif.lib.IntegerParameter">
<doc></doc>
</entity>

<entity name="IntegerVariable" class="ptolemy.apps.hsif.lib.IntegerVariable">
<doc></doc>
</entity>

<entity name="Invariant" class="ptolemy.apps.hsif.lib.Invariant">
<doc></doc>
</entity>

<entity name="Parameter" class="ptolemy.apps.hsif.lib.Parameter">
<doc></doc>
</entity>

<entity name="RealParameter" class="ptolemy.apps.hsif.lib.RealParameter">
<doc></doc>
</entity>

<entity name="RealVariable" class="ptolemy.apps.hsif.lib.RealVariable">
<doc></doc>
</entity>

<entity name="SendAction" class="ptolemy.apps.hsif.lib.SendAction">
<doc></doc>
</entity>

<entity name="Transition" class="ptolemy.apps.hsif.lib.Transition">
<doc></doc>
</entity>

<entity name="UpdateAction" class="ptolemy.apps.hsif.lib.UpdateAction">
<doc></doc>
</entity>

<entity name="Variable" class="ptolemy.apps.hsif.lib.Variable">
<doc></doc>
</entity>
      </group>
    ?>
  </configure>
</entity>
