<?xml version="1.0" standalone="no"?>
<!DOCTYPE plot PUBLIC "-//UC Berkeley//DTD MoML 1//EN"
    "http://ptolemy.eecs.berkeley.edu/xml/dtd/MoML_1.dtd">

<entity name="GraphTransformation" class="ptolemy.moml.EntityLibrary">
  <configure>
    <?moml
      <group>
        <property name="TransformationAttribute" class="ptolemy.actor.gt.TransformationAttribute">
          <property name="_icon" class="ptolemy.vergil.icon.ValueIcon">
            <property name="_color" class="ptolemy.actor.gui.ColorAttribute" value="{0.0, 0.0, 1.0, 1.0}"/>
          </property>
        </property>
        <entity name="ModelGenerator" class="ptolemy.actor.gt.ModelGenerator"/>
        <entity name="ModelView" class="ptolemy.actor.gt.ModelView"/>
        <entity name="TransformationRule" class="ptolemy.actor.gt.TransformationRule"/>
      </group>
    ?>
  </configure>
</entity>
