<?xml version="1.0" standalone="no"?>
<!DOCTYPE entity PUBLIC "-//UC Berkeley//DTD MoML 1//EN"
    "http://ptolemy.eecs.berkeley.edu/xml/dtd/MoML_1.dtd">
<entity name="ClientServer" class="ptolemy.actor.TypedCompositeActor">
    <property name="_vergilSize" class="ptolemy.actor.gui.SizeAttribute" value="[604, 454]">
    </property>
    <property name="_vergilLocation" class="ptolemy.actor.gui.LocationAttribute" value="[102, 100]">
    </property>
    <property name="SR" class="ptolemy.domains.sr.kernel.SRDirector">
        <property name="iterations" class="ptolemy.data.expr.Parameter" value="6">
        </property>
        <property name="_location" class="ptolemy.moml.Location" value="71.0, 47.0">
        </property>
    </property>
    <entity name="NonStrictClient" class="ptolemy.domains.sr.lib.NonStrictClient">
        <property name="_location" class="ptolemy.moml.Location" value="267.0, 224.0">
        </property>
        <port name="dataInput" class="ptolemy.actor.TypedIOPort">
            <property name="input"/>
        </port>
        <port name="indexOutput" class="ptolemy.actor.TypedIOPort">
            <property name="output"/>
        </port>
        <port name="dataOutput" class="ptolemy.actor.TypedIOPort">
            <property name="output"/>
        </port>
    </entity>
    <entity name="Server" class="ptolemy.domains.sr.lib.Server">
        <property name="index" class="ptolemy.data.expr.Parameter" value="{1, 2, 4, 8, 16}">
        </property>
        <property name="_location" class="ptolemy.moml.Location" value="115.0, 120.0">
        </property>
        <port name="input" class="ptolemy.actor.TypedIOPort">
            <property name="input"/>
        </port>
        <port name="output" class="ptolemy.actor.TypedIOPort">
            <property name="output"/>
        </port>
    </entity>
    <entity name="Test" class="ptolemy.actor.lib.Test">
        <property name="correctValues" class="ptolemy.data.expr.Parameter" value="{1, 2, 4, 8, 16}">
        </property>
        <property name="tolerance" class="ptolemy.data.expr.Parameter" value="1.0E-9">
        </property>
        <property name="_location" class="ptolemy.moml.Location" value="385.0, 266.0">
        </property>
        <port name="input" class="ptolemy.actor.TypedIOPort">
            <property name="input"/>
            <property name="multiport"/>
        </port>
    </entity>
    <relation name="relation" class="ptolemy.actor.TypedIORelation">
    </relation>
    <relation name="relation2" class="ptolemy.actor.TypedIORelation">
    </relation>
    <relation name="relation3" class="ptolemy.actor.TypedIORelation">
    </relation>
    <link port="NonStrictClient.dataInput" relation="relation2"/>
    <link port="NonStrictClient.indexOutput" relation="relation"/>
    <link port="NonStrictClient.dataOutput" relation="relation3"/>
    <link port="Server.input" relation="relation"/>
    <link port="Server.output" relation="relation2"/>
    <link port="Test.input" relation="relation3"/>
</entity>
