<?xml version="1.0" standalone="no"?>
<!DOCTYPE entity PUBLIC "-//UC Berkeley//DTD MoML 1//EN"
    "http://ptolemy.eecs.berkeley.edu/xml/dtd/MoML_1.dtd">
<entity name="UnsignedFixConst" class="ptolemy.actor.TypedCompositeActor">
    <property name="_createdBy" class="ptolemy.kernel.attributes.VersionAttribute" value="6.1.devel">
    </property>
    <property name="_windowProperties" class="ptolemy.actor.gui.WindowPropertiesAttribute" value="{bounds={147, 94, 815, 518}, maximized=false}">
    </property>
    <property name="_vergilSize" class="ptolemy.actor.gui.SizeAttribute" value="[600, 400]">
    </property>
    <property name="_vergilZoomFactor" class="ptolemy.data.expr.ExpertParameter" value="1.0">
    </property>
    <property name="_vergilCenter" class="ptolemy.data.expr.ExpertParameter" value="{300.0, 200.0}">
    </property>
    <property name="SR Director" class="ptolemy.domains.sr.kernel.SRDirector">
        <property name="_location" class="ptolemy.kernel.util.Location" value="[175.0, 150.0]">
        </property>
    </property>
    <entity name="Unsigned" class="ptolemy.actor.lib.vhdl.FixConst">
        <property name="outputPrecision" class="ptolemy.data.expr.StringParameter" value="U1.0">
        </property>
        <property name="value" class="ptolemy.data.expr.Parameter" value="0.23456">
        </property>
        <property name="_location" class="ptolemy.kernel.util.Location" value="[115.0, 240.0]">
        </property>
    </entity>
    <entity name="Test" class="ptolemy.actor.lib.Test">
        <property name="correctValues" class="ptolemy.data.expr.Parameter" value="{}">
        </property>
        <property name="tolerance" class="ptolemy.data.expr.Parameter" value="0">
        </property>
        <property name="trainingMode" class="ptolemy.moml.SharedParameter" value="false">
        </property>
        <property name="_location" class="ptolemy.kernel.util.Location" value="{360.0, 250.0}">
        </property>
    </entity>
    <relation name="relation" class="ptolemy.actor.TypedIORelation">
        <property name="width" class="ptolemy.data.expr.Parameter" value="1">
        </property>
    </relation>
    <link port="Unsigned.output" relation="relation"/>
    <link port="Test.input" relation="relation"/>
</entity>
