<?xml version="1.0" standalone="no"?>
<!DOCTYPE entity PUBLIC "-//UC Berkeley//DTD MoML 1//EN"
    "http://ptolemy.eecs.berkeley.edu/xml/dtd/MoML_1.dtd">
<!-- This file contains a single factory, for editing          -->
<!-- Fmv automata.                                       -->
<property name="factoryERG"
	class="ptolemy.actor.gui.PtolemyTableauFactory">
	<property name="Event Relation Graph Editor"
		class="ptolemy.vergil.erg.ERGGraphTableau$Factory">
      <property name="_library" class="ptolemy.moml.LibraryAttribute">
        <configure>
          <entity name="StateLibrary" class="ptolemy.kernel.CompositeEntity">
            <input source="ptolemy/configs/basicUtilities.xml"/>
            <entity name="Event" class="ptolemy.domains.erg.kernel.Event">
              <property name="_centerName" class="ptolemy.kernel.util.Attribute"/>
            </entity>
          </entity>
        </configure>
      </property>
	</property>
	<property name="Tree View"
		class="ptolemy.vergil.tree.TreeTableau$Factory" />
	<property name="XML view"
		class="ptolemy.actor.gui.TextEditorTableau$Factory" />
</property>
