<?xml version="1.0" standalone="no"?>
<!DOCTYPE entity PUBLIC "-//UC Berkeley//DTD MoML 1//EN"
    "http://ptolemy.eecs.berkeley.edu/xml/dtd/MoML_1.dtd">
<entity name="CTinsideDT2_" class="ptolemy.actor.TypedCompositeActor">
    <property name="DT1" class="ptolemy.domains.dt.kernel.DTDirector">
        <property name="iterations" class="ptolemy.data.expr.Parameter" value="10">
        </property>
        <property name="vectorizationFactor" class="ptolemy.data.expr.Parameter" value="1">
        </property>
        <property name="period" class="ptolemy.data.expr.Parameter" value="10.0">
        </property>
        <rendition name="_icon" class="ptolemy.vergil.toolbox.EditorIcon">
            <location value="50.0, 33.0"/>
        </rendition>
    </property>
    <entity name="typed composite actor0" class="ptolemy.actor.TypedCompositeActor">
        <rendition name="_icon" class="ptolemy.vergil.toolbox.EditorIcon">
            <location value="177.0, 186.0"/>
        </rendition>
        <property name="CT0" class="ptolemy.domains.ct.kernel.CTMixedSignalDirector">
            <property name="startTime" class="ptolemy.data.expr.Parameter" value="0.0">
            </property>
            <property name="stopTime" class="ptolemy.data.expr.Parameter" value="100000">
            </property>
            <property name="initStepSize" class="ptolemy.data.expr.Parameter" value="0.1">
            </property>
            <property name="minStepSize" class="ptolemy.data.expr.Parameter" value="1.0E-5">
            </property>
            <property name="maxStepSize" class="ptolemy.data.expr.Parameter" value="1.0">
            </property>
            <property name="maxIterations" class="ptolemy.data.expr.Parameter" value="20">
            </property>
            <property name="errorTolerance" class="ptolemy.data.expr.Parameter" value="1.0E-4">
            </property>
            <property name="valueResolution" class="ptolemy.data.expr.Parameter" value="1.0E-6">
            </property>
            <property name="timeResolution" class="ptolemy.data.expr.Parameter" value="1.0E-10">
            </property>
            <property name="ODESolver" class="ptolemy.data.expr.Parameter" value="&quot;ptolemy.domains.ct.kernel.solver.ExplicitRK23Solver&quot;">
                <property name="style" class="ptolemy.actor.gui.style.EditableChoiceStyle">
                    <property name="choice0" class="ptolemy.data.expr.Parameter" value="&quot;ptolemy.domains.ct.kernel.solver.ExplicitRK23Solver&quot;">
                    </property>
                    <property name="choice1" class="ptolemy.data.expr.Parameter" value="&quot;ptolemy.domains.ct.kernel.solver.BackwardEulerSolver&quot;">
                    </property>
                    <property name="choice2" class="ptolemy.data.expr.Parameter" value="&quot;ptolemy.domains.ct.kernel.solver.ForwardEulerSolver&quot;">
                    </property>
                </property>
            </property>
            <property name="breakpointODESolver" class="ptolemy.data.expr.Parameter" value="&quot;ptolemy.domains.ct.kernel.solver.DerivativeResolver&quot;">
                <property name="style" class="ptolemy.actor.gui.style.EditableChoiceStyle">
                    <property name="choice0" class="ptolemy.data.expr.Parameter" value="&quot;ptolemy.domains.ct.kernel.solver.DerivativeResolver&quot;">
                    </property>
                    <property name="choice1" class="ptolemy.data.expr.Parameter" value="&quot;ptolemy.domains.ct.kernel.solver.BackwardEulerSolver&quot;">
                    </property>
                    <property name="choice2" class="ptolemy.data.expr.Parameter" value="&quot;ptolemy.domains.ct.kernel.solver.ImpulseBESolver&quot;">
                    </property>
                </property>
            </property>
            <property name="runAheadLength" class="ptolemy.data.expr.Parameter" value="0.1">
            </property>
            <rendition name="_icon" class="ptolemy.vergil.toolbox.EditorIcon">
                <location value="49.0, 42.0"/>
            </rendition>
        </property>
        <port name="port4" class="ptolemy.actor.TypedIOPort">
            <property name="output"/>
            <property name="location1" class="ptolemy.moml.Location">
                <location value="485.0, 200.0"/>
            </property>
        </port>
        <entity name="Integrator1" class="ptolemy.domains.ct.lib.Integrator">
            <property name="initialState" class="ptolemy.data.expr.Parameter" value="1.0">
            </property>
            <rendition name="_icon" class="ptolemy.vergil.toolbox.EditorIcon">
                <location value="171.0, 89.0"/>
            </rendition>
            <port name="input" class="ptolemy.actor.TypedIOPort">
                <property name="input"/>
            </port>
            <port name="output" class="ptolemy.actor.TypedIOPort">
                <property name="output"/>
            </port>
        </entity>
        <entity name="Integrator2" class="ptolemy.domains.ct.lib.Integrator">
            <property name="initialState" class="ptolemy.data.expr.Parameter" value="1.0">
            </property>
            <rendition name="_icon" class="ptolemy.vergil.toolbox.EditorIcon">
                <location value="257.0, 89.0"/>
            </rendition>
            <port name="input" class="ptolemy.actor.TypedIOPort">
                <property name="input"/>
            </port>
            <port name="output" class="ptolemy.actor.TypedIOPort">
                <property name="output"/>
            </port>
        </entity>
        <entity name="Scale3" class="ptolemy.actor.lib.Scale">
            <property name="factor" class="ptolemy.data.expr.Parameter" value="3">
            </property>
            <rendition name="_icon" class="ptolemy.vergil.toolbox.LibraryIcon">
                <location value="355.0, 90.0"/>
            </rendition>
            <port name="input" class="ptolemy.actor.TypedIOPort">
                <property name="input"/>
            </port>
            <port name="output" class="ptolemy.actor.TypedIOPort">
                <property name="output"/>
            </port>
        </entity>
        <relation name="relation6" class="ptolemy.actor.TypedIORelation">
        </relation>
        <relation name="relation7" class="ptolemy.actor.TypedIORelation">
        </relation>
        <relation name="relation0" class="ptolemy.actor.TypedIORelation">
            <vertex name="vertex1" class="ptolemy.moml.Vertex">
                <location value="395.0, 200.0"/>
            </vertex>
        </relation>
        <link port="port4" relation="relation0"/>
        <link port="Integrator1.input" relation="relation0"/>
        <link port="Integrator1.output" relation="relation7"/>
        <link port="Integrator2.input" relation="relation7"/>
        <link port="Integrator2.output" relation="relation6"/>
        <link port="Scale3.input" relation="relation6"/>
        <link port="Scale3.output" relation="relation0"/>
    </entity>
    <entity name="CurrentTime2" class="ptolemy.actor.lib.CurrentTime">
        <property name="stopTime" class="ptolemy.data.expr.Parameter" value="0.0">
        </property>
        <rendition name="_icon" class="ptolemy.vergil.toolbox.LibraryIcon">
            <location value="287.0, 287.0"/>
        </rendition>
        <port name="output" class="ptolemy.actor.TypedIOPort">
            <property name="output"/>
        </port>
        <port name="trigger" class="ptolemy.actor.TypedIOPort">
            <property name="input"/>
            <property name="multiport"/>
        </port>
    </entity>
    <entity name="Display4" class="ptolemy.actor.lib.gui.Display">
        <property name="rowsDisplayed" class="ptolemy.data.expr.Parameter" value="10">
        </property>
        <property name="columnsDisplayed" class="ptolemy.data.expr.Parameter" value="40">
        </property>
        <rendition name="_icon" class="ptolemy.vergil.toolbox.LibraryIcon">
            <location value="342.0, 187.0"/>
        </rendition>
        <port name="input" class="ptolemy.actor.TypedIOPort">
            <property name="input"/>
            <property name="multiport"/>
        </port>
    </entity>
    <entity name="Display5" class="ptolemy.actor.lib.gui.Display">
        <property name="rowsDisplayed" class="ptolemy.data.expr.Parameter" value="10">
        </property>
        <property name="columnsDisplayed" class="ptolemy.data.expr.Parameter" value="40">
        </property>
        <rendition name="_icon" class="ptolemy.vergil.toolbox.LibraryIcon">
            <location value="383.0, 286.0"/>
        </rendition>
        <port name="input" class="ptolemy.actor.TypedIOPort">
            <property name="input"/>
            <property name="multiport"/>
        </port>
    </entity>
    <relation name="relation3" class="ptolemy.actor.TypedIORelation">
        <vertex name="vertex1" class="ptolemy.moml.Vertex">
            <location value="228.0, 193.0"/>
        </vertex>
    </relation>
    <relation name="relation6" class="ptolemy.actor.TypedIORelation">
    </relation>
    <link port="typed composite actor0.port4" relation="relation3"/>
    <link port="CurrentTime2.output" relation="relation6"/>
    <link port="CurrentTime2.trigger" relation="relation3"/>
    <link port="Display4.input" relation="relation3"/>
    <link port="Display5.input" relation="relation6"/>
</entity>
