<?xml version="1.0" standalone="no"?>
<!DOCTYPE entity PUBLIC "-//UC Berkeley//DTD MoML 1//EN"
    "http://ptolemy.eecs.berkeley.edu/xml/dtd/MoML_1.dtd">
<entity name="OpenModelicaPltPlot" class="ptolemy.actor.TypedCompositeActor">
    <property name="size" class="ptolemy.data.expr.Parameter" value="25">
    </property>
    <property name="_createdBy" class="ptolemy.kernel.attributes.VersionAttribute" value="9.1.devel">
    </property>
    <property name="_windowProperties" class="ptolemy.actor.gui.WindowPropertiesAttribute" value="{bounds={-8, -8, 1382, 744}, maximized=false}">
    </property>
    <property name="_vergilZoomFactor" class="ptolemy.data.expr.ExpertParameter" value="1.0">
    </property>
    <property name="_vergilCenter" class="ptolemy.data.expr.ExpertParameter" value="{430.0, 301.5}">
    </property>
    <property name="_vergilSize" class="ptolemy.actor.gui.SizeAttribute" value="[1154, 628]">
    </property>
    <property name="_icon" class="ptolemy.vergil.icon.EditorIcon">
    </property>
    <property name="_layoutConfiguration" class="ptolemy.vergil.basic.layout.LayoutConfiguration">
    </property>
    <property name="enableBackwardTypeInference" class="ptolemy.data.expr.Parameter" value="true">
        <property name="style" class="ptolemy.actor.gui.style.LineStyle">
        </property>
    </property>
    <property name="Annotation" class="ptolemy.vergil.kernel.attributes.TextAttribute">
        <property name="textColor" class="ptolemy.actor.gui.ColorAttribute" value="{0.4,0.4,0.4,1.0}">
        </property>
        <property name="text" class="ptolemy.kernel.util.StringAttribute" value="Author: Mana Mirzaei">
        </property>
        <property name="_location" class="ptolemy.kernel.util.Location" value="[5.0, 500.0]">
        </property>
    </property>
    <property name="Annotation2" class="ptolemy.vergil.kernel.attributes.TextAttribute">
        <property name="textSize" class="ptolemy.data.expr.Parameter" value="14">
        </property>
        <property name="text" class="ptolemy.kernel.util.StringAttribute" value="This model verifies plotting when the output format is set to the plt.&#10;">
        </property>
        <property name="_location" class="ptolemy.kernel.util.Location" value="[125.0, 35.0]">
        </property>
    </property>
    <property name="OpenModelica Director" class="ptolemy.domains.openmodelica.kernel.OpenModelicaDirector">
        <property name="_location" class="ptolemy.kernel.util.Location" value="[-40.0, 115.0]">
        </property>
    </property>
    <property name="_expertMode" class="ptolemy.kernel.util.SingletonAttribute">
    </property>
    <property name="Annotation4" class="ptolemy.vergil.kernel.attributes.TextAttribute">
        <property name="textSize" class="ptolemy.data.expr.Parameter" value="12">
        </property>
        <property name="textColor" class="ptolemy.actor.gui.ColorAttribute" value="{1.0,0.0,0.0,1.0}">
        </property>
        <property name="text" class="ptolemy.kernel.util.StringAttribute" value="This model requires that OpenModelica be installed (see http://www.openmodelica.org).&#10;In addition,  the OPENMODELICAHOME environment variable must be set and the&#10;PATH must be set to include the OPENMODELICAHOME/bin directory.&#10;&#10;Under Mac OS X:&#10;export OPENMODELICAHOME=/opt/openmodelica&#10;export PATH=${OPENMODELICAHOME}/bin:${PATH}">
        </property>
        <property name="_location" class="ptolemy.kernel.util.Location" value="[335.0, 405.0]">
        </property>
    </property>
    <property name="Annotation3" class="ptolemy.vergil.kernel.attributes.TextAttribute">
        <property name="textSize" class="ptolemy.data.expr.Parameter" value="14">
        </property>
        <property name="italic" class="ptolemy.data.expr.Parameter" value="false">
        </property>
        <property name="anchor" class="ptolemy.data.expr.StringParameter" value="northwest">
        </property>
        <property name="text" class="ptolemy.kernel.util.StringAttribute" value="The output format should be set to the plt.&#10;The processing mode should be set to the batch.&#10;After running the model, the simulation result file &#10;is generated in the plt format &#10;in the OpenModelica dir of the user dir which is located in the dir&#10;named by the java.io.tmpdir property.&#10;Finally, the result is plotted by PxgraphApplication.&#10;&#10;">
        </property>
        <property name="_location" class="ptolemy.kernel.util.Location" value="[5.0, 180.0]">
        </property>
    </property>
    <entity name="OpenModelica" class="ptolemy.domains.openmodelica.lib.OpenModelica">
        <property name="fileName" class="ptolemy.data.expr.FileParameter" value="dcmotor.mo">
            <display name="File name"/>
        </property>
        <property name="modelName" class="ptolemy.data.expr.StringParameter" value="dcmotor">
            <display name="Model name"/>
        </property>
        <property name="outputFormat" class="ptolemy.data.expr.StringParameter" value="plt">
            <display name="Output format"/>
        </property>
        <property name="_icon" class="ptolemy.vergil.icon.BoxedValueIcon">
            <property name="attributeName" class="ptolemy.kernel.util.StringAttribute" value="expression">
            </property>
            <property name="displayWidth" class="ptolemy.data.expr.Parameter" value="60">
            </property>
        </property>
        <property name="_location" class="ptolemy.kernel.util.Location" value="[-25.0, 180.0]">
        </property>
    </entity>
</entity>
