<?xml version="1.0" standalone="no"?>
<!DOCTYPE entity PUBLIC "-//UC Berkeley//DTD MoML 1//EN"
    "http://ptolemy.eecs.berkeley.edu/xml/dtd/MoML_1.dtd">
<entity name="AssemblyLine" class="ptolemy.actor.TypedCompositeActor">
    <property name="_createdBy" class="ptolemy.kernel.attributes.VersionAttribute" value="4.1">
    </property>
    <property name="DE Director" class="ptolemy.domains.de.kernel.DEDirector">
        <property name="stopTime" class="ptolemy.data.expr.Parameter" value="50">
        </property>
        <property name="_location" class="ptolemy.kernel.util.Location" value="[220.0, 60.0]">
        </property>
    </property>
    <property name="_windowProperties" class="ptolemy.actor.gui.WindowPropertiesAttribute" value="{bounds={129, 62, 800, 846}, maximized=false}">
    </property>
    <property name="_vergilSize" class="ptolemy.actor.gui.SizeAttribute" value="[585, 728]">
    </property>
    <property name="_vergilZoomFactor" class="ptolemy.data.expr.ExpertParameter" value="1.0">
    </property>
    <property name="_vergilCenter" class="ptolemy.data.expr.ExpertParameter" value="{218.5694444444445, 341.8767361111111}">
    </property>
    <property name="Annotation" class="ptolemy.vergil.kernel.attributes.TextAttribute">
        <property name="text" class="ptolemy.kernel.util.StringAttribute" value="This demo shows how to use the NonInterruptibleTimer actor and Pulse actor to&#10;model an assembly line.&#10;&#10;The Clock actor (Jobs) generates a set of jobs at different times, where no two&#10;jobs happen at the same time. The Pulse actor (ServiceTimes) takes a job &#10;request and produces the service time of the job request. &#10;&#10;The NonInterruptibleTimer actor (Station) takes the service time and sets a&#10;timer. The timer goes off when the service time expires. The timer can not&#10;be interrupted to respond to another input when it is running. &#10;&#10;A job has to be passed along all three stations. &#10;&#10;The Plotter monitors the outputs from Stations plots the times when jobs &#10;leaves the station.&#10;&#10;This model is based on the assembly line example described in &quot;Distributed &#10;Discrete-Event Simulation&quot; by Jayadev Misra, Computer Serveys, Vol. 18, &#10;No. 1, March 1986.">
        </property>
        <property name="_location" class="ptolemy.kernel.util.Location" value="[-47.5, 375.0]">
        </property>
    </property>
    <property name="ModelID" class="ptolemy.vergil.kernel.attributes.IDAttribute">
        <property name="created" class="ptolemy.kernel.util.StringAttribute" value="Oct 22, 2004 12:00:12 AM">
        </property>
        <property name="lastUpdated" class="ptolemy.kernel.util.StringAttribute" value="Oct 22, 2004 12:19:09 AM">
        </property>
        <property name="author" class="ptolemy.kernel.util.StringAttribute" value="hyzheng">
        </property>
        <property name="_location" class="ptolemy.kernel.util.Location" value="[760.0, 670.0]">
        </property>
    </property>
    <entity name="Jobs" class="ptolemy.actor.lib.Clock">
        <property name="period" class="ptolemy.data.expr.Parameter" value="Infinity">
        </property>
        <property name="offsets" class="ptolemy.data.expr.Parameter" value="{5.0, 7.0, 30.0, 32.0}">
        </property>
        <property name="values" class="ptolemy.data.expr.Parameter" value="{4, 10, 1, 5}">
        </property>
        <doc>Create a set of pulses</doc>
        <property name="_location" class="ptolemy.kernel.util.Location" value="[15.0, 70.0]">
        </property>
    </entity>
    <entity name="TimedPlotter" class="ptolemy.actor.lib.gui.TimedPlotter">
        <property name="fillOnWrapup" class="ptolemy.data.expr.Parameter" value="false">
        </property>
        <property name="legend" class="ptolemy.kernel.util.StringAttribute" value="Station 1,Station 2, Station 3">
        </property>
        <property name="_location" class="ptolemy.kernel.util.Location" value="[392.5, 290.0]">
        </property>
        <configure>
<?plotml <!DOCTYPE plot PUBLIC "-//UC Berkeley//DTD PlotML 1//EN"
"http://ptolemy.eecs.berkeley.edu/xml/dtd/PlotML_1.dtd">
<plot>
<title>Times when jobs leave work stations.</title>
<xLabel></xLabel>
<yLabel></yLabel>
<xRange min="0.0" max="50.0"/>
<yRange min="0.0" max="3.0"/>
<default connected="no" marks="dots" stems="yes"/>
</plot>?>
        </configure>
    </entity>
    <entity name="ServiceTimes 2" class="ptolemy.actor.lib.Pulse">
        <property name="indexes" class="ptolemy.data.expr.Parameter" value="{0, 1, 2, 3}">
        </property>
        <property name="values" class="ptolemy.data.expr.Parameter" value="{12, 15, 2, 7}">
        </property>
        <property name="_location" class="ptolemy.kernel.util.Location" value="[40.0, 255.0]">
        </property>
    </entity>
    <entity name="ServiceTimes 3" class="ptolemy.actor.lib.Pulse">
        <property name="indexes" class="ptolemy.data.expr.Parameter" value="{0, 1, 2, 3}">
        </property>
        <property name="values" class="ptolemy.data.expr.Parameter" value="{2, 3, 1, 4}">
        </property>
        <property name="_location" class="ptolemy.kernel.util.Location" value="[37.5, 340.0]">
        </property>
    </entity>
    <entity name="TimedPlotter2" class="ptolemy.actor.lib.gui.TimedPlotter">
        <property name="fillOnWrapup" class="ptolemy.data.expr.Parameter" value="false">
        </property>
        <property name="_location" class="ptolemy.kernel.util.Location" value="[330.0, 125.0]">
        </property>
        <configure>
<?plotml <!DOCTYPE plot PUBLIC "-//UC Berkeley//DTD PlotML 1//EN"
"http://ptolemy.eecs.berkeley.edu/xml/dtd/PlotML_1.dtd">
<plot>
<title>Times when jobs arrive.</title>
<xLabel></xLabel>
<yLabel></yLabel>
<xRange min="0.0" max="50.0"/>
<yRange min="0.0" max="50.0"/>
<default connected="no" marks="dots" stems="yes"/>
</plot>?>
        </configure>
    </entity>
    <entity name="ServiceTimes 1" class="ptolemy.actor.lib.Pulse">
        <property name="indexes" class="ptolemy.data.expr.Parameter" value="{0, 1, 2, 3}">
        </property>
        <property name="values" class="ptolemy.data.expr.Parameter" value="{4, 10, 1, 5}">
        </property>
        <property name="_location" class="ptolemy.kernel.util.Location" value="[35.0, 175.0]">
        </property>
    </entity>
    <entity name="CurrentTime" class="ptolemy.actor.lib.CurrentTime">
        <doc>Output the current time.</doc>
        <property name="_location" class="ptolemy.kernel.util.Location" value="{195, 125}">
        </property>
    </entity>
    <entity name="Station 1" class="ptolemy.domains.de.lib.NonInterruptibleTimer">
        <property name="value" class="ptolemy.data.expr.Parameter" value="1">
        </property>
        <property name="_location" class="ptolemy.kernel.util.Location" value="[130.0, 175.0]">
        </property>
    </entity>
    <entity name="Station 2" class="ptolemy.domains.de.lib.NonInterruptibleTimer">
        <property name="value" class="ptolemy.data.expr.Parameter" value="2">
        </property>
        <property name="_location" class="ptolemy.kernel.util.Location" value="[135.0, 255.0]">
        </property>
    </entity>
    <entity name="Station 3" class="ptolemy.domains.de.lib.NonInterruptibleTimer">
        <property name="value" class="ptolemy.data.expr.Parameter" value="3">
        </property>
        <property name="_location" class="ptolemy.kernel.util.Location" value="[132.5, 340.0]">
        </property>
    </entity>
    <relation name="relation" class="ptolemy.actor.TypedIORelation">
        <vertex name="vertex1" value="[197.5, 212.5]">
        </vertex>
    </relation>
    <relation name="relation4" class="ptolemy.actor.TypedIORelation">
        <vertex name="vertex1" value="[192.5, 290.0]">
        </vertex>
    </relation>
    <relation name="relation7" class="ptolemy.actor.TypedIORelation">
        <vertex name="vertex1" value="[70.0, 125.0]">
        </vertex>
    </relation>
    <relation name="relation3" class="ptolemy.actor.TypedIORelation">
    </relation>
    <relation name="relation8" class="ptolemy.actor.TypedIORelation">
    </relation>
    <relation name="relation2" class="ptolemy.actor.TypedIORelation">
    </relation>
    <relation name="relation5" class="ptolemy.actor.TypedIORelation">
    </relation>
    <relation name="relation6" class="ptolemy.actor.TypedIORelation">
    </relation>
    <link port="Jobs.output" relation="relation7"/>
    <link port="TimedPlotter.input" relation="relation"/>
    <link port="TimedPlotter.input" relation="relation4"/>
    <link port="TimedPlotter.input" relation="relation6"/>
    <link port="ServiceTimes 2.output" relation="relation2"/>
    <link port="ServiceTimes 2.trigger" relation="relation"/>
    <link port="ServiceTimes 3.output" relation="relation5"/>
    <link port="ServiceTimes 3.trigger" relation="relation4"/>
    <link port="TimedPlotter2.input" relation="relation3"/>
    <link port="ServiceTimes 1.output" relation="relation8"/>
    <link port="ServiceTimes 1.trigger" relation="relation7"/>
    <link port="CurrentTime.output" relation="relation3"/>
    <link port="CurrentTime.trigger" relation="relation7"/>
    <link port="Station 1.input" relation="relation8"/>
    <link port="Station 1.output" relation="relation"/>
    <link port="Station 2.input" relation="relation2"/>
    <link port="Station 2.output" relation="relation4"/>
    <link port="Station 3.input" relation="relation5"/>
    <link port="Station 3.output" relation="relation6"/>
</entity>
