<?xml version="1.0" standalone="no"?>
<!DOCTYPE plot PUBLIC "-//UC Berkeley//DTD MoML 1//EN"
    "http://ptolemy.eecs.berkeley.edu/xml/dtd/MoML_1.dtd">
<entity name="VHDL" class="ptolemy.moml.EntityLibrary">
  <configure>
    <?moml
      <group>
  <doc>Arithmetic and mathematical functions</doc>
  
  <entity name="Concat" class="ptolemy.apps.vhdl.Concat">
  </entity>  
  
  <entity name="Memory" class="ptolemy.apps.vhdl.Memory">
  </entity>
  
  <entity name="Multiplexor" class="ptolemy.apps.vhdl.Multiplexor">
  </entity>
  
  <entity name="Slice" class="ptolemy.apps.vhdl.Slice">
  </entity>

      </group>
    ?>
  </configure>
</entity>
