<?xml version="1.0" standalone="no"?>
<!DOCTYPE entity PUBLIC "-//UC Berkeley//DTD MoML 1//EN"
    "http://ptolemy.eecs.berkeley.edu/xml/dtd/MoML_1.dtd">
<entity name="inconsistentRates" class="ptolemy.actor.TypedCompositeActor">
    <property name="_vergilSize" class="ptolemy.actor.gui.SizeAttribute" value="[604, 454]">
    </property>
    <property name="_vergilLocation" class="ptolemy.actor.gui.LocationAttribute" value="[102, 100]">
    </property>
    <property name="SDF" class="ptolemy.domains.sdf.kernel.SDFDirector">
        <property name="iterations" class="ptolemy.data.expr.Parameter" value="0">
        </property>
        <property name="vectorizationFactor" class="ptolemy.data.expr.Parameter" value="1">
        </property>
        <property name="_location" class="ptolemy.moml.Location" value="79.0, 42.0">
        </property>
    </property>
    <entity name="Gaussian" class="ptolemy.actor.lib.Gaussian">
        <property name="seed" class="ptolemy.data.expr.Parameter" value="0">
        </property>
        <property name="mean" class="ptolemy.data.expr.Parameter" value="0.0">
        </property>
        <property name="standardDeviation" class="ptolemy.data.expr.Parameter" value="1.0">
        </property>
        <doc>Create a sequence of gaussian random variables</doc>
        <property name="_location" class="ptolemy.moml.Location" value="81.0, 157.0">
        </property>
        <port name="output" class="ptolemy.actor.TypedIOPort">
            <property name="output"/>
        </port>
        <port name="trigger" class="ptolemy.actor.TypedIOPort">
            <property name="input"/>
            <property name="multiport"/>
        </port>
    </entity>
    <entity name="SequencePlotter" class="ptolemy.actor.lib.gui.SequencePlotter">
        <property name="fillOnWrapup" class="ptolemy.data.expr.Parameter" value="true">
        </property>
        <property name="legend" class="ptolemy.kernel.util.StringAttribute">
        </property>
        <property name="startingDataset" class="ptolemy.data.expr.Parameter" value="0">
        </property>
        <property name="xInit" class="ptolemy.data.expr.Parameter" value="0.0">
        </property>
        <property name="xUnit" class="ptolemy.data.expr.Parameter" value="1.0">
        </property>
        <property name="_location" class="ptolemy.moml.Location" value="302.0, 155.0">
        </property>
        <port name="input" class="ptolemy.actor.TypedIOPort">
            <property name="input"/>
            <property name="multiport"/>
        </port>
    </entity>
    <relation name="relation" class="ptolemy.actor.TypedIORelation">
        <vertex name="vertex1" class="ptolemy.moml.Vertex" value="138.0, 162.0">
        </vertex>
    </relation>
    <link port="Gaussian.output" relation="relation"/>
</entity>
